{
  "id": "FOUND-002",
  "epic": "EPIC-00",
  "feature": "FEAT-FOUND-01",
  "title": "Criar apps api, cms e intranet",
  "type": "tooling",
  "status": "ready",
  "priority": "high",
  "objective": "Criar apps api, cms e intranet de forma verificável e sem ampliar o escopo do Foundation.",
  "depends_on": [
    "FOUND-001"
  ],
  "references": {
    "screens": [],
    "docs": [
      "docs/ARCHITECTURE.md",
      "docs/DECISIONS.md"
    ],
    "api": []
  },
  "context": {
    "required": [
      "AGENTS.md",
      ".agents/backlog/tasks/FOUND-002.json",
      "docs/ARCHITECTURE.md",
      "docs/DECISIONS.md"
    ],
    "optional": [
      "docs/PRODUCT.md"
    ]
  },
  "scope": {
    "apps": [
      "root",
      "api",
      "cms",
      "intranet"
    ],
    "allowed_areas": [
      "package.json",
      "pnpm-workspace.yaml",
      "turbo.json",
      "apps/",
      "packages/",
      "docker/",
      "pnpm-lock.yaml",
      "compose.yml",
      "README.md",
      ".github/"
    ]
  },
  "requirements": [
    "Criar apps/api com NestJS",
    "Criar apps/cms com Next.js",
    "Criar apps/intranet com Next.js"
  ],
  "acceptance_criteria": [
    {
      "id": "AC-01",
      "description": "apps/api, apps/cms e apps/intranet existem como workspaces pnpm independentes e declaram respectivamente NestJS, Next.js e Next.js como framework principal",
      "verification": "automated",
      "blocking": true
    },
    {
      "id": "AC-02",
      "description": "O script dev de cada aplicação inicia sua aplicação isoladamente via pnpm --filter api dev, pnpm --filter cms dev e pnpm --filter intranet dev, com evidência de inicialização pronta em cada caso",
      "verification": "automated",
      "blocking": true
    },
    {
      "id": "AC-03",
      "description": "Os nomes dos pacotes são api, cms e intranet e cada um pode ser selecionado individualmente pelo filtro do pnpm",
      "verification": "review",
      "blocking": true
    }
  ],
  "non_goals": [
    "Não implementar features de negócio"
  ],
  "validation": {
    "commands": [
    "pnpm lint",
    "pnpm typecheck",
    "pnpm test",
    "pnpm build",
    "pnpm --filter api dev",
    "pnpm --filter cms dev",
    "pnpm --filter intranet dev"
    ]
  }
}
