{
  "id": "FOUND-008",
  "epic": "EPIC-00",
  "feature": "FEAT-FOUND-02",
  "title": "Configurar variáveis de ambiente",
  "type": "tooling",
  "status": "planned",
  "priority": "high",
  "objective": "Configurar variáveis de ambiente de forma verificável e sem ampliar o escopo do Foundation.",
  "depends_on": [
    "FOUND-002",
    "FOUND-006",
    "FOUND-007"
  ],
  "references": {
    "screens": [],
    "docs": [
      "docs/ARCHITECTURE.md",
      "docs/DECISIONS.md"
    ],
    "api": []
  },
  "context": {
    "required": [
      "AGENTS.md",
      ".agents/backlog/tasks/FOUND-008.json",
      "docs/ARCHITECTURE.md",
      "docs/DECISIONS.md"
    ],
    "optional": [
      "docs/PRODUCT.md"
    ]
  },
  "scope": {
    "apps": [
      "root",
      "api",
      "cms",
      "intranet"
    ],
    "allowed_areas": [
      "package.json",
      "pnpm-workspace.yaml",
      "turbo.json",
      "apps/",
      "packages/",
      "docker/",
      "compose.yml",
      "README.md",
      ".github/"
    ]
  },
  "requirements": [
    "Criar exemplos de env",
    "Validar env da API",
    "Documentar variáveis"
  ],
  "acceptance_criteria": [
    {
      "id": "AC-01",
      "description": "Nenhum segredo real é versionado",
      "verification": "review",
      "blocking": true
    },
    {
      "id": "AC-02",
      "description": ".env.example existe onde necessário",
      "verification": "automated",
      "blocking": true
    },
    {
      "id": "AC-03",
      "description": "Falha de env obrigatória é explícita",
      "verification": "review",
      "blocking": true
    }
  ],
  "non_goals": [
    "Não incluir credenciais reais"
  ],
  "validation": {
    "commands": [
      "pnpm lint",
      "pnpm typecheck",
      "pnpm test",
      "pnpm build"
    ]
  }
}
