{
  "id": "FOUND-005",
  "epic": "EPIC-00",
  "feature": "FEAT-FOUND-01",
  "title": "Configurar lint e formatação",
  "type": "tooling",
  "status": "planned",
  "priority": "high",
  "objective": "Configurar lint e formatação de forma verificável e sem ampliar o escopo do Foundation.",
  "depends_on": [
    "FOUND-003"
  ],
  "references": {
    "screens": [],
    "docs": [
      "docs/ARCHITECTURE.md",
      "docs/DECISIONS.md"
    ],
    "api": []
  },
  "context": {
    "required": [
      "AGENTS.md",
      ".agents/backlog/tasks/FOUND-005.json",
      "docs/ARCHITECTURE.md",
      "docs/DECISIONS.md"
    ],
    "optional": [
      "docs/PRODUCT.md"
    ]
  },
  "scope": {
    "apps": [
      "root",
      "api",
      "cms",
      "intranet"
    ],
    "allowed_areas": [
      "package.json",
      "pnpm-workspace.yaml",
      "turbo.json",
      "apps/",
      "packages/",
      "docker/",
      "compose.yml",
      "README.md",
      ".github/"
    ]
  },
  "requirements": [
    "Configurar ESLint compartilhado",
    "Configurar formatação consistente"
  ],
  "acceptance_criteria": [
    {
      "id": "AC-01",
      "description": "pnpm lint existe na raiz",
      "verification": "automated",
      "blocking": true
    },
    {
      "id": "AC-02",
      "description": "Apps e packages participam do lint",
      "verification": "review",
      "blocking": true
    }
  ],
  "non_goals": [
    "Não adicionar regras experimentais"
  ],
  "validation": {
    "commands": [
      "pnpm lint",
      "pnpm typecheck",
      "pnpm test",
      "pnpm build"
    ]
  }
}
