{
  "id": "FOUND-011",
  "epic": "EPIC-00",
  "feature": "FEAT-FOUND-04",
  "title": "Criar health endpoint da API",
  "type": "backend",
  "status": "planned",
  "priority": "high",
  "objective": "Criar health endpoint da API de forma verificável e sem ampliar o escopo do Foundation.",
  "depends_on": [
    "FOUND-002",
    "FOUND-007"
  ],
  "references": {
    "screens": [],
    "docs": [
      "docs/ARCHITECTURE.md",
      "docs/DECISIONS.md"
    ],
    "api": []
  },
  "context": {
    "required": [
      "AGENTS.md",
      ".agents/backlog/tasks/FOUND-011.json",
      "docs/ARCHITECTURE.md",
      "docs/DECISIONS.md"
    ],
    "optional": [
      "docs/PRODUCT.md"
    ]
  },
  "scope": {
    "apps": [
      "api"
    ],
    "allowed_areas": [
      "package.json",
      "pnpm-workspace.yaml",
      "turbo.json",
      "apps/",
      "packages/",
      "docker/",
      "compose.yml",
      "README.md",
      ".github/"
    ]
  },
  "requirements": [
    "Criar GET /health",
    "Retornar estado básico da aplicação"
  ],
  "acceptance_criteria": [
    {
      "id": "AC-01",
      "description": "GET /health responde 200 quando aplicação está saudável",
      "verification": "automated",
      "blocking": true
    },
    {
      "id": "AC-02",
      "description": "Endpoint possui teste",
      "verification": "automated",
      "blocking": true
    }
  ],
  "non_goals": [
    "Não expor dados sensíveis"
  ],
  "validation": {
    "commands": [
      "pnpm lint",
      "pnpm typecheck",
      "pnpm test",
      "pnpm build"
    ]
  }
}
