{
  "id": "FOUND-012",
  "epic": "EPIC-00",
  "feature": "FEAT-FOUND-04",
  "title": "Criar páginas mínimas de health dos frontends",
  "type": "frontend",
  "status": "planned",
  "priority": "high",
  "objective": "Criar páginas mínimas de health dos frontends de forma verificável e sem ampliar o escopo do Foundation.",
  "depends_on": [
    "FOUND-002"
  ],
  "references": {
    "screens": [],
    "docs": [
      "docs/ARCHITECTURE.md",
      "docs/DECISIONS.md"
    ],
    "api": []
  },
  "context": {
    "required": [
      "AGENTS.md",
      ".agents/backlog/tasks/FOUND-012.json",
      "docs/ARCHITECTURE.md",
      "docs/DECISIONS.md"
    ],
    "optional": [
      "docs/PRODUCT.md"
    ]
  },
  "scope": {
    "apps": [
      "root",
      "api",
      "cms",
      "intranet"
    ],
    "allowed_areas": [
      "package.json",
      "pnpm-workspace.yaml",
      "turbo.json",
      "apps/",
      "packages/",
      "docker/",
      "compose.yml",
      "README.md",
      ".github/"
    ]
  },
  "requirements": [
    "Criar página mínima de CMS",
    "Criar página mínima de Intranet"
  ],
  "acceptance_criteria": [
    {
      "id": "AC-01",
      "description": "CMS renderiza sem erro",
      "verification": "review",
      "blocking": true
    },
    {
      "id": "AC-02",
      "description": "Intranet renderiza sem erro",
      "verification": "review",
      "blocking": true
    }
  ],
  "non_goals": [
    "Não implementar layout final"
  ],
  "validation": {
    "commands": [
      "pnpm lint",
      "pnpm typecheck",
      "pnpm test",
      "pnpm build"
    ]
  }
}
